{
  "artifact_sha256": {
    "trial-output/challenger.py": "42fd224693ecd425f829bf951899be2dfaa45ae6a8c96332c10239e0d6bedd77",
    "trial-output/comparison-report.json": "ba8fd3f2ce1a7dcbc23c0bb2a9eac453e683593572b1994c666ddc48ae0a37de",
    "trial-output/research-result.json": "56f902d3c25d7b48e233d0f5d523644fb927dbd651a518dc51127d258ec10734"
  },
  "case_id": "paper-backed-coverage-challenger",
  "execution_mode": "fresh-native-run",
  "expected_snapshot_sha256": "0eb9f86950a897b02258d924f9ea7de31e1ad0c2040b7ec35d39a68b44224a99",
  "fresh_native_invocation": true,
  "harness": "codex",
  "initial_file_sha256": {
    ".github/ISSUE_TEMPLATE/algorithm-research.yml": "5c5f718e2f8a96698b02dd381ed45617524fda2f7411525e0d89a3962c5523b1",
    ".github/ISSUE_TEMPLATE/benchmark-reproducibility.yml": "a460d32c7f8cff00cf20f83373dca02cb9c706538fd01e071b56b74657fcb369",
    ".github/ISSUE_TEMPLATE/bug-report.yml": "b636077e987484dc10cc13f8bcb378118b129145ede485dd30026c60ade44564",
    ".github/ISSUE_TEMPLATE/config.yml": "9072988da58148dd045d7c0e6d1c6e2c71de65ecd633ede7128f0f95fdf53763",
    ".github/ISSUE_TEMPLATE/harness-adapter.yml": "fe41f417d4e73821db715b41a5b8f4ff05f0f368eeefdc5c06fa9d3dc8c21bed",
    ".github/PULL_REQUEST_TEMPLATE.md": "a7b82cb148f2c31073e2eb7cfbeef09439c412495c738c4549942258b8b2795a",
    ".github/scripts/check_compatibility.py": "b4cad37c597569c45cce80b3aa1738e36b4509e66b9251fc82ea175abd5a44b4",
    ".github/scripts/validate_agent_docs.py": "e7fc757932c2e28501c5f8c7dd7c4fb4bef340afe49ac273b8ac220c87c71195",
    ".github/scripts/validation/__init__.py": "21cb0b53d94f3d72f3809483fd5050de2175773c20aad17ed72311c3b3a6ef86",
    ".github/scripts/validation/anchors.py": "f5c78a1fb203b1e461d4dec1e9ffeb195f4608aa22d01fc816bb7bb586e2ec26",
    ".github/scripts/validation/baselines.py": "259a87b1684b8333c2bdbe9a91d8b99fc9f24873aa9248a2b5ea4314cb50b90d",
    ".github/scripts/validation/campaign.py": "0223782b9ab418c95bf34238ea7a647c9ed065dcd0c7e1cfdb1075e9368b8a0a",
    ".github/scripts/validation/common.py": "72a591d6f935d8dbf12602e31bb836fb3243e3fd2cb5d14a4eab8ce015dfc174",
    ".github/scripts/validation/compatibility.py": "f3c1a3b9b6a67bf26996926fd1e5c458e072a03c3a084ccc2ce56fcc8aff138c",
    ".github/scripts/validation/controls.py": "c75d59f7987c2312c32e3ccd74bd8262c01256fc610902839de79240b34e90f2",
    ".github/scripts/validation/entrypoints.py": "5485b80b92b4b45c634e871f8d35dccd920936f3f9fea0369a6361ccd4866f2e",
    ".github/scripts/validation/evals.py": "1c1a8a603bf1929751fc9800770c86968275f6a53a3b4e15fe32b894c4ba7026",
    ".github/scripts/validation/executables.py": "902074f8e176db14d00fd20df44bc1c850915bac5ef874939e6720fc0ec28734",
    ".github/scripts/validation/first_read.py": "cf6574e82b69bd9f7e2d92a1783050e1b3c8e0b8fce2aed02a794f0f2eaf203c",
    ".github/scripts/validation/guidance.py": "1635aadc769d24a0764f3aacc95511a5537cc699f8d685a40faa6915a57470cb",
    ".github/scripts/validation/opportunities.py": "b332bb038259d3f02dae0071407677a6093711c7693edac52838c0257c481f01",
    ".github/scripts/validation/protocol.py": "3076bc5de219043ecc5bac7d1347bab92c7ff5dc9cec33b09c6ba1796fda8f1b",
    ".github/scripts/validation/records.py": "f8fbbd94efffcd83e3186fd60497de74dd85ecba73d3cf8f4eb9fd16e8ab9793",
    ".github/scripts/validation/registry.py": "6bdcd827979dfed03ca32dc05f547de61e987a65b5fe239ae257b6fb7a763e52",
    ".github/scripts/validation/resources.py": "17479dc09f15d87f87a0d5357931d05d89959faeff18683b5a86a5996546d0ce",
    ".github/scripts/validation/selftest.py": "e94373186420a336302c1638acf15af1f7196cd64d92a731e240ad69825cdcca",
    ".github/scripts/validation/state_machine.py": "7abb756a6e8847a5800e58fd56d8beb240897929ede5e967ddeb5bdc6b46a136",
    ".github/workflows/agent-guidance.yml": "688df6d6b7c9a0c3f974d1a03767eaf21c4f0e9c4ab70f300c64ca272529ae81",
    ".github/workflows/compatibility-observation.yml": "c3ae77a6fb8e1b6be00890d21fc890a93bd6f276d28a2c2dcca4927a1a9c6965",
    ".github/workflows/security.yml": "419fc6a86dde8e0e68e62e6ff2aa7bc0f29275cc4a8c4d327e32f540c811aa33",
    ".gitignore": "b8aeda8e51500f9f33ab84ece1a725d162a2f3568eb032f8a92e89be8ae8c96d",
    ".ruff_cache/.gitignore": "9e3a60f1e6ec4ae60215c11d54b171392745ec25e9dded433d5bd921363af316",
    ".ruff_cache/0.16.5/10520906021441656377": "ca58d43758dc391d41dba3caf46341642bba9876cb3f2b8d7f1a3ed93589f778",
    ".ruff_cache/0.16.5/17398778812958858323": "7355e648d6e264201e4e452f719fd7d0fc3ff75eb5ba25c68159aba2cbeaa67d",
    ".ruff_cache/0.16.5/406943585089991983": "0ea179b54047e8c60d36fa98d8f1ef768e1919be20c4e8c66a26b070d261d6f9",
    ".ruff_cache/0.16.5/4582036594962047241": "cb7ca4d8de5c98728f2bc05a3b0902a555ca323dbea141fbb1570002557597f6",
    ".ruff_cache/0.16.5/5335990705416394379": "2e5587bb4aed8ee8a7858ba3c7e107bc99ce2b2847b09eb71361125714392696",
    ".ruff_cache/0.16.5/598874730071243986": "a5e3b56bc35a69c639de7e567969e97e8860ca20cb4f029f5a0972574603df58",
    ".ruff_cache/0.16.5/8349204456499869115": "cd84d1243bd36c35edd32889f4ebd3382fa7b43fe5461a0f84eb013256891e57",
    ".ruff_cache/CACHEDIR.TAG": "5953156d7e0c564a427251316eaf26f8870e6483ae2197f916b630e4f93e31ae",
    "AGENTS.md": "9f970c943ac438c7cd3e0a85623f30ff306cb123d59573c93dd92faea436bad9",
    "CLAUDE.md": "7e328ef61b22d47b8dd81128eb7c56c462db10ec5baed215eb374da36f6c1062",
    "CONTRIBUTING.md": "6bea3414a00b5293bc606266c3d57337659d6fcf7ca517992662881391edc70d",
    "LICENSE": "f19604701400ce0409b28e7718eee459becf6c65795feb7a15f4c7e8a475f6ac",
    "README.md": "232572febec9e788b3a03b82f56a475a775028811e58ce34630fc99b89aa51cc",
    "docs/agents/background-agent.md": "4d601c7e9e2f01730d5e8a25da2556ba115477d4c53795bc2c4bcbd327adddcb",
    "docs/agents/compensation.md": "69fcf7a04eee6c3c804dcbb1e517b5ff1417e5332a06e9fb0d85da4487228db3",
    "docs/agents/contributing-research.md": "1cae9cb6abe2cdc2082cc215f4866566dfe608f327fa3f692778c53a20f4cd1c",
    "docs/agents/core-concepts.md": "f74bd76f8b07a82179d27c9d3c828bede868845f885217a8445f4b73e762fdca",
    "docs/agents/diagnostics.md": "35b756ac951dde47b6cf372d989a6568eb08604f713b4abb4eb60d9221e4f88f",
    "docs/agents/eras.md": "da4bd9d363845d30abaed8da5ba1f0698c433c013f1b539442bd0795a7712564",
    "docs/agents/faq.md": "5b106d14a5a888f23ffe4589af24e0a891c484db138161cc0f9dad3db2edae17",
    "docs/agents/first-contribution.md": "32f7f3a44db6e98ec8509cd02c5dfc690c4851308b91acb06057cac89ee65a16",
    "docs/agents/first-search.md": "e8a8bd9dc95145d08999a8488f498a4cfeb7e710a31318720c09eb379759674b",
    "docs/agents/harness-verification.md": "64fc88a1e34b60dc091bb0d34d2532a6b0b995cafaeff559e9c0a4ae39b8ba27",
    "docs/agents/install-authenticate.md": "bf4989480e59339b703a5662c0b6de3bada69ef71662eb6452452263ed56c434",
    "docs/agents/quickstart.md": "1350e9e5438cc2a47dbac85acfb68528c77a5b89a6451c4120053a0284c3d379",
    "docs/agents/references/campaign-state-machine.json": "6553a10a33120480c9198418403cd01d422c22cec6696eba67fd3b83eb49cba7",
    "docs/agents/references/compatibility.json": "e34eb8c8b2533e07b67e014d7c1995e0c7e4237d9928c41e8deae782b9328c2f",
    "docs/agents/references/onboarding.json": "434eb7be6f4f509e9782b2c225e315fdac5e97149c5a45ae33662765fb4e0193",
    "docs/agents/research-campaign.md": "c074e9724e43a0dcfad4d1e94a2dede723cd5238f3342b0858358d3ec3bbe3bd",
    "docs/agents/research-opportunities.json": "725f26696652a2439f1f27b1fd1f979d3a8ac48bbc57d6911718d288dd564eba",
    "docs/agents/research-opportunities.md": "3326ddf88cfde28f9adb7a1c04c20687b58777473cc935fb4320516472115321",
    "docs/agents/research-security.md": "29258e4126736b2e3d82cb771869ac8169a2bb32ba9873d69890a23fa35249ca",
    "docs/agents/simulation-settings.md": "8c5d291a385da1cecbdf84f6cbb7c58256bf0a65511f4d03d12b77ec7de26b70",
    "docs/agents/start-here.md": "f62302df9d50e324efe55b57cfcfa443f866ac052168eedd1d27545bc07fd5f7",
    "docs/agents/submission-status.md": "1422bc483a98b8f8c57453a31a26eae51c4c4196f9d6145103cc8224f82ef849",
    "docs/depositors/deposit-and-mint.md": "1ee191a1c70e53476f90c0dd98138fbc71a441e36b2dcadf1054b173d42a8eac",
    "docs/depositors/faq.md": "2ef115c16654b308a51413551c65d531719d9d8f209889409b6f11309793adee",
    "docs/depositors/forage-airdrops.md": "35adfdb7fc22a876157bfed540bca55d1c7e39e8836873e586f861133c846bc5",
    "docs/depositors/quickstart.md": "594c8bbe0b52ed3d82bde5cb54e96be7b0c7f4f0571af2b23aad37ebfd28bac2",
    "docs/depositors/tiers-lockups.md": "9dd508bfd0c9ec3b49c6fe81f5b01877deb4a12315043281f482a7ea56298d0e",
    "docs/depositors/vault-participation.md": "483afa39ea3637166bda89d8eeef548ca49416581c4ce327cd4b6469b90d1559",
    "docs/depositors/withdrawals.md": "67c74044d447c9a22d200e097cdf3fd44af8004b31c9ecfb325be8a3788e471d",
    "docs/protocol/execution-venue.md": "cfbc1218c00defbed062c6e3a8097d2b63fc4011f8f71b2617fa78693e725877",
    "docs/protocol/overview.md": "a73edcbf0e3a0e8bdf2ba6ea07e3b0f6d3f52c8c4b83044b72e1f3492538c28d",
    "docs/protocol/revenue.md": "5684b322d0ecfc09887601b5ca3d83576f6bdf7de7c2a157eae02bee076de879",
    "docs/protocol/smart-contracts.md": "288faaba36247070a470158d24998b629bf1b1ba23fdab4a662dc4b941976ed9",
    "docs/protocol/synthetic-dollar.md": "de947dcdf68591c640596b782c96a014530cf56f6e5fea3f47eeb458b49fb141",
    "docs/protocol/transparency.md": "f7c72b158a1761bcc6158eb49e4ea5874c691b8c2718a81e58a9d169d09cb21f",
    "docs/resources/glossary.md": "6515a0267cb0f33d9071082ec34c771fc2e624498cc6aa1562e913de6869154c",
    "docs/resources/security-reviews.md": "3db1da15c0fa68c2fe6278da95a80eec9bfec92036424fba031533a39e332ac4",
    "docs/start-here/how-signals-work.md": "8812be33a1057bf491b308f14c1f57fd88d9bc64ff449dadd2e9af2e991d922d",
    "docs/start-here/how-the-system-works.md": "7c6462dba5fac709eb4e7f992b00ae1bf10e132662925256a2b0751576a9defa",
    "docs/start-here/index.md": "4d2f32df6da497ca7511ea9ff3e4a47faa41ac475515c5e5947ac8e308904078",
    "docs/start-here/onboard-your-agent.md": "272e9228393799a92f41395e34fd3978739741df822ff7954bdd6000dd1b4dba",